{
  "$schema": "https://json-schema.org/draft/2020-12/schema",
  "$id": "urn:oikos:contracts:0.8:module",
  "title": "Behaviour module manifest",
  "description": "What a behaviour module declares, checked when a world loads (docs/design/rebuild.md 5.2): its parameters (types, units, ranges, and each figure's source or that it's a placeholder), what it relies on perceiving, the beliefs it keeps (for truth audits), the decisions it records, and that its state can be saved (for checkpoints). A world that doesn't give a module what it declares is refused at load, naming the module.",
  "type": "object",
  "required": [
    "name",
    "version",
    "doc",
    "params",
    "perceives"
  ],
  "additionalProperties": false,
  "properties": {
    "name": {
      "type": "string",
      "pattern": "^[a-z][a-z0-9_]*\\.[a-z][a-z0-9_.]*$",
      "description": "As worlds name it in controller.impl, e.g. citizen.default."
    },
    "version": {
      "type": "string",
      "pattern": "^[0-9]+\\.[0-9]+\\.[0-9]+$"
    },
    "doc": {
      "type": "string",
      "description": "Where its rules are documented, with their sources."
    },
    "params": {
      "type": "object",
      "description": "Each parameter, by name.",
      "additionalProperties": {
        "$ref": "#/$defs/Param"
      }
    },
    "perceives": {
      "type": "array",
      "description": "What it relies on perceiving: the seat's channels must provide each.",
      "items": {
        "$ref": "#/$defs/Need"
      },
      "maxItems": 256
    },
    "beliefs": {
      "type": "array",
      "description": "Beliefs it reports each wake for truth audits (docs/design/rebuild.md 8.2).",
      "items": {
        "$ref": "#/$defs/Belief"
      },
      "maxItems": 64
    },
    "decisions": {
      "type": "array",
      "description": "Domains of the decisions it records.",
      "items": {
        "type": "string",
        "maxLength": 64
      },
      "maxItems": 64
    },
    "state": {
      "enum": [
        "serialisable",
        "none"
      ],
      "description": "Whether it saves and restores its state, for resuming from a checkpoint."
    },
    "keeps": {
      "type": "array",
      "description": "Whole collections its seats are shown unasked because this is the office that keeps them (the land registry its register, a bank its customers' instructions), each with the reason. Nobody is shown a whole register, population or map unless its module says so here (docs/no-god-view.md).",
      "items": {
        "$ref": "#/$defs/Kept"
      },
      "maxItems": 64
    },
    "boundary": {
      "type": "array",
      "description": "What it carries of the world's edge: boundary conditions of the simulation it is handed (the weather to come, the outside market's scripted prices), each with the reason (docs/no-god-view.md).",
      "items": {
        "$ref": "#/$defs/Kept"
      },
      "maxItems": 64
    },
    "takes": {
      "type": "array",
      "description": "The written directions its office takes (docs/behaviour/directions.md): for each, the form the office publishes for it and what following one means. A direction is followed only when it is filed on the form by someone the office's organisation says may direct it (a record of the world's, never this manifest), from the office's next plan until it is replaced or withdrawn. A world publishes one form for each, from this declaration.",
      "items": {
        "$ref": "#/$defs/Taken"
      },
      "maxItems": 16
    },
    "routines": {
      "type": "array",
      "description": "The routine tasks its office's staff do by standing work order (docs/behaviour/standing-work.md; contracts/calls.md, a standing work order): for each, the task's name as an order names it, what doing it is, in words, and which parameter says where it is done. Where a model holds the office, a world gives the office's staff a post of their own, run by this module, which does a routine only while a standing order of the organisation's is in force for it; the office-holder sets the orders.",
      "items": {
        "type": "object",
        "required": ["task", "what", "at"],
        "additionalProperties": false,
        "properties": {
          "task": { "type": "string", "pattern": "^[a-z][a-z0-9_]{0,63}$" },
          "what": { "type": "string", "minLength": 20, "maxLength": 1000 },
          "at": { "type": "string", "pattern": "^[a-z][a-z0-9_]{0,63}$", "description": "The parameter that holds the place the work is done at." },
          "every": { "description": "The routine's own rhythm, where the office's practice has one: days, or the parameter that gives them with what it is where none is given. Said in the office's procedure; a standing work order that does not say how often follows it.", "oneOf": [{ "type": "integer", "minimum": 1, "maximum": 3650 }, { "type": "array", "prefixItems": [{ "type": "string", "pattern": "^[a-z][a-z0-9_]{0,63}$" }, { "type": "integer", "minimum": 1, "maximum": 3650 }], "items": false, "minItems": 2, "maxItems": 2 }] },
          "papers": { "type": "array", "maxItems": 16, "description": "For a routine whose task is `answer` (the counter): the kinds of incoming paper the office's counter staff sort and answer under the office's procedure, and, in plain words, how. Such a paper does not bring the office-holder back, and reaches them as a count and a sample; anything addressed to the office-holder's own post by name, or resting on a paper they made themself, reaches them whatever its kind (docs/behaviour/standing-work.md, the counter).", "items": { "type": "object", "required": ["kind", "how"], "additionalProperties": false, "properties": { "kind": { "type": "string", "pattern": "^[a-z][a-z0-9_]{0,63}$" }, "how": { "type": "string", "minLength": 10, "maxLength": 400 } } } },
          "follows": { "description": "Where when the routine is done is set by a published paper and not by a rhythm (a rating law's instalments): the parameter that names the paper, with the paper where none is given. A standing work order may name it in place of how often, or say nothing.", "type": "array", "prefixItems": [{ "type": "string", "pattern": "^[a-z][a-z0-9_]{0,63}$" }, { "type": "string", "pattern": "^[a-z][a-z0-9_-]{0,63}$" }], "items": false, "minItems": 2, "maxItems": 2 }
        }
      },
      "maxItems": 16
    },
    "issues": {
      "type": "array",
      "description": "The papers its office issues, each as a form of the office's own stationery (docs/behaviour/office-papers.md): the form's fields, and how they are written into the statement the rest of the world reads (outcomes.schema.json, FormWrites). In `writes`, a string \"@name\" stands for something of the office's own that a world fills in when it publishes the form. A world publishes these for an office a model holds; filled in, each makes the paper the module itself makes.",
      "items": {
        "$ref": "#/$defs/Issued"
      },
      "maxItems": 32
    }
  },
  "$defs": {
    "Issued": {
      "type": "object",
      "required": [
        "form",
        "title",
        "fields",
        "writes"
      ],
      "additionalProperties": false,
      "properties": {
        "form": {
          "type": "string",
          "pattern": "^[a-z][a-z0-9_]{0,63}$"
        },
        "title": {
          "type": "string",
          "minLength": 5,
          "maxLength": 200
        },
        "does": {
          "type": "string",
          "description": "What issuing the paper does, for whoever holds the office: said on the form with its name. A sentence; or, for a paper that is a step of a procedure a law sets (a notice to vacate, an order for possession), a few: what it does, what it does not do by itself, and where what the law asks before it is written.",
          "minLength": 5,
          "maxLength": 1000
        },
        "fields": {
          "type": "object",
          "propertyNames": {
            "pattern": "^[a-z_][a-z0-9_]{0,31}$"
          },
          "additionalProperties": {
            "$ref": "#/$defs/Field"
          },
          "maxProperties": 32
        },
        "writes": {
          "$ref": "urn:oikos:contracts:0.8:outcomes#/$defs/FormWrites"
        }
      }
    },
    "Taken": {
      "type": "object",
      "required": [
        "form",
        "title",
        "fields",
        "follows"
      ],
      "additionalProperties": false,
      "properties": {
        "form": {
          "type": "string",
          "pattern": "^[a-z][a-z0-9_]{0,63}$",
          "description": "The form's name, as the call language's form names it."
        },
        "title": {
          "type": "string",
          "minLength": 5,
          "maxLength": 200,
          "description": "What the form is, in a few words."
        },
        "fields": {
          "type": "object",
          "description": "The form's fields, as a form's data has them (outcomes.schema.json, FormData).",
          "propertyNames": {
            "pattern": "^[a-z_][a-z0-9_]{0,31}$"
          },
          "additionalProperties": {
            "$ref": "#/$defs/Field"
          },
          "maxProperties": 32
        },
        "follows": {
          "type": "string",
          "minLength": 20,
          "maxLength": 1000,
          "description": "What following it means, in words: what the office does while the direction stands."
        }
      }
    },
    "Field": {
      "type": "object",
      "required": [
        "type",
        "description"
      ],
      "additionalProperties": false,
      "properties": {
        "type": {
          "$ref": "urn:oikos:contracts:0.8:outcomes#/$defs/FieldType"
        },
        "required": {
          "type": "boolean"
        },
        "options": {
          "type": "array",
          "items": {
            "type": "string",
            "maxLength": 200
          },
          "maxItems": 32
        },
        "description": {
          "type": "string",
          "minLength": 5,
          "maxLength": 500
        }
      }
    },
    "Param": {
      "type": "object",
      "required": [
        "schema"
      ],
      "additionalProperties": false,
      "properties": {
        "schema": {
          "type": "object",
          "description": "A JSON Schema for its value."
        },
        "unit": {
          "type": "string",
          "maxLength": 32,
          "description": "e.g. cents, bps, days, seconds, count."
        },
        "default": {},
        "required": {
          "type": "boolean",
          "description": "The world must give it (whom a module deals with, a place's figures)."
        },
        "source": {
          "type": "string",
          "maxLength": 2000,
          "description": "Where the default figure comes from; 'placeholder' when it's unsourced."
        }
      }
    },
    "Kept": {
      "type": "object",
      "required": [
        "what",
        "why"
      ],
      "additionalProperties": false,
      "properties": {
        "what": {
          "type": "string",
          "maxLength": 64,
          "description": "A statement kind (enrolment), a record type (records:claim), directory, map, every entity of a kind (every:factory), or future."
        },
        "why": {
          "type": "string",
          "minLength": 20,
          "maxLength": 1000,
          "description": "Why this kind of participant holds it whole, in words."
        }
      }
    },
    "Need": {
      "type": "object",
      "additionalProperties": false,
      "properties": {
        "channel_kind": {
          "enum": [
            "accounts",
            "holdings",
            "records",
            "sites",
            "directory"
          ]
        },
        "statement_kinds": {
          "type": "array",
          "items": {
            "type": "string",
            "maxLength": 64
          },
          "maxItems": 64
        },
        "has": {
          "type": "array",
          "items": {
            "enum": [
              "offer",
              "practice",
              "adico",
              "formal",
              "assertion",
              "registry",
              "hears"
            ]
          },
          "maxItems": 8
        },
        "why": {
          "type": "string",
          "maxLength": 500
        }
      }
    },
    "Belief": {
      "type": "object",
      "required": [
        "name",
        "about"
      ],
      "additionalProperties": false,
      "properties": {
        "name": {
          "type": "string",
          "maxLength": 64,
          "description": "e.g. job, home, members_at."
        },
        "about": {
          "enum": [
            "agreement",
            "entity",
            "occupancy",
            "account"
          ],
          "description": "What in the world it's checked against."
        },
        "why": {
          "type": "string",
          "maxLength": 500
        }
      }
    }
  }
}
