{
  "name": "body.payroll",
  "version": "0.4.0",
  "doc": "docs/behaviour/staffing.md",
  "params": {
    "after_days": {
      "schema": {
        "type": "integer",
        "description": "an appointer: how long a post has stood vacant before the authority fills it (the body's own deputy has its few days first)"
      },
      "unit": "days",
      "default": 14,
      "source": "placeholder"
    },
    "industry": {
      "schema": {
        "type": "string"
      },
      "default": "",
      "source": "placeholder"
    },
    "notice_days": {
      "schema": {
        "type": "integer"
      },
      "unit": "days",
      "default": 14,
      "source": "placeholder"
    },
    "own": {
      "schema": {
        "type": "array",
        "description": "an appointer: the posts of its own body (no deputy keeps them filled, so it need not wait for one)"
      },
      "default": [],
      "source": "placeholder"
    },
    "part": {
      "schema": {
        "type": "string",
        "description": "the officer runs the payroll; the deputy keeps the officer's post filled; the appointer is the authority a body's constitution names, which fills a post of that body when none of its own staff is left to"
      },
      "default": "officer",
      "source": "placeholder"
    },
    "payroll_office": {
      "schema": {
        "type": "string"
      },
      "default": "",
      "source": "placeholder"
    },
    "period": {
      "schema": {
        "type": "integer"
      },
      "default": 1209600,
      "source": "placeholder"
    },
    "role": {
      "schema": {
        "type": "string",
        "description": "when the organisation's own module employs others (the clinic's doctors), the role of the staff this payroll pays: absent, all of the organisation's"
      },
      "default": "",
      "source": "when the organisation's own module employs others (the clinic's doctors), the role of the staff this payroll pays: absent, all of the organisation's"
    },
    "staff_line": {
      "schema": {
        "type": "string"
      },
      "default": "",
      "source": "placeholder"
    },
    "wage": {
      "schema": {
        "type": "integer"
      },
      "default": 0,
      "source": "placeholder"
    },
    "watch": {
      "schema": {
        "type": "array",
        "description": "the organisation's posts a person holds, which this post keeps filled"
      },
      "default": [],
      "source": "placeholder"
    },
    "who": {
      "schema": {
        "type": "string",
        "description": "its channel onto who's who"
      },
      "default": "who",
      "source": "placeholder"
    },
    "workplace": {
      "schema": {
        "type": "string"
      },
      "default": "",
      "source": "placeholder"
    }
  },
  "perceives": [],
  "state": "none"
}
