{
  "name": "city.councillor",
  "version": "0.6.0",
  "doc": "docs/behaviour/government.md",
  "params": {
    "budget_yes_bps": {
      "schema": {
        "type": "integer"
      },
      "unit": "bps",
      "default": 9000,
      "source": "placeholder"
    },
    "leaning": {
      "schema": {
        "type": "integer"
      },
      "default": 0,
      "source": "placeholder"
    },
    "motion": {
      "schema": {},
      "source": "the world gives it (no default)"
    },
    "noise_bps": {
      "schema": {
        "type": "integer"
      },
      "unit": "bps",
      "default": 1500,
      "source": "placeholder"
    }
  },
  "perceives": [],
  "state": "none"
}
