{
  "name": "world.statistics",
  "version": "0.1.0",
  "doc": "docs/behaviour/boundary.md",
  "params": {
    "adverts": {
      "schema": {
        "type": "string",
        "description": "its channel onto what sellers advertise, searched (the world must say)"
      },
      "default": "",
      "required": true,
      "source": "its channel onto what sellers advertise, searched (the world must say)"
    },
    "every_days": {
      "schema": {
        "type": "integer"
      },
      "unit": "days",
      "default": 30,
      "source": "placeholder"
    },
    "sample": {
      "schema": {
        "type": "integer",
        "description": "outlets priced a month, at most (placeholder: what one search reads)"
      },
      "default": 200,
      "source": "outlets priced a month, at most (placeholder: what one search reads)"
    }
  },
  "perceives": [],
  "state": "none"
}
