{
  "name": "city.inspector",
  "version": "0.7.0",
  "doc": "docs/behaviour/institutions.md",
  "params": {
    "compliance_bps": {
      "schema": {
        "type": "integer"
      },
      "unit": "bps",
      "default": 10000,
      "source": "placeholder"
    },
    "directed_under": {
      "schema": {
        "type": "string"
      },
      "default": "",
      "source": "placeholder"
    },
    "direction_compliance_bps": {
      "schema": {
        "type": "integer"
      },
      "unit": "bps",
      "default": 10000,
      "source": "placeholder"
    },
    "fine": {
      "schema": {
        "type": "integer"
      },
      "default": 5000000,
      "source": "placeholder"
    },
    "register": {
      "schema": {
        "type": "object",
        "description": "the land register, asked about one lot"
      },
      "default": {
        "lots": "lots",
        "titles": "titles",
        "dealings": "dealings"
      },
      "source": "placeholder"
    },
    "sites": {
      "schema": {
        "type": "string",
        "description": "the channel it goes to a site through (a visit)"
      },
      "default": "sites",
      "source": "placeholder"
    },
    "valuer": {
      "schema": {
        "type": "string",
        "description": "whom it tells of what was built or brought down (none: nobody)"
      },
      "default": "",
      "source": "placeholder"
    }
  },
  "perceives": [],
  "state": "none",
  "takes": [
    {
      "form": "inspector_enforcement",
      "title": "Enforcement direction to the building inspector",
      "fields": {
        "fines": {
          "type": "choice",
          "options": [
            "yes",
            "no"
          ],
          "required": true,
          "description": "Whether a breach the inspector finds is fined and ordered demolished: yes, as the office does of its own accord; no, it is recorded and nothing more."
        },
        "fine": {
          "type": "amount",
          "description": "The fine for a breach, where it is to be other than the office's usual one."
        }
      },
      "follows": "While a direction with fines no stands, the inspector still goes to the sites it is told of and still tells the valuer what was built, but lays no fine and makes no demolition order on a breach: it records the breach in its report. With fines yes, it fines and orders as before, at the amount given if one is."
    }
  ],
  "issues": [
    {
      "form": "valuation_request",
      "title": "Request to the valuer for a supplementary valuation",
      "fields": {
        "notice": {
          "type": "record",
          "required": true,
          "description": "The notice of building work it follows from."
        },
        "lot": {
          "type": "lot",
          "description": "The lot."
        },
        "structure": {
          "type": "structure",
          "description": "What was built."
        },
        "structure_type": {
          "type": "structure_type",
          "description": "The kind of building."
        },
        "removed": {
          "type": "structure",
          "description": "What was demolished."
        }
      },
      "writes": {
        "kind": "valuation_request",
        "text": "Supplementary valuation asked for, on notice {notice}.",
        "basis": "=notice",
        "to": [
          "@valuer"
        ],
        "data": {
          "lot": "=lot",
          "structure": "=structure",
          "structure_type": "=structure_type",
          "removed": "=removed"
        }
      }
    },
    {
      "form": "demolition_order",
      "title": "Order to demolish a building",
      "fields": {
        "owner": {
          "type": "entity",
          "required": true,
          "description": "The owner ordered to demolish it."
        },
        "structure": {
          "type": "structure",
          "required": true,
          "description": "The building."
        },
        "law": {
          "type": "record",
          "required": true,
          "description": "The law it was built in breach of."
        },
        "lot": {
          "type": "lot",
          "description": "The lot it stands on."
        }
      },
      "writes": {
        "kind": "demolition_order",
        "text": "Order: demolish {structure}, built in breach of {law}.",
        "basis": "=law",
        "to": [
          "=owner"
        ],
        "data": {
          "structure": "=structure",
          "lot": "=lot",
          "law": "=law"
        }
      }
    }
  ]
}
