{
  "name": "office.clerk",
  "version": "0.2.0",
  "doc": "docs/behaviour/office-books.md",
  "params": {
    "of": {
      "schema": {
        "type": "string"
      },
      "default": "",
      "source": "placeholder"
    },
    "with": {
      "schema": {
        "type": "object"
      },
      "default": {},
      "source": "placeholder"
    }
  },
  "perceives": [],
  "state": "none"
}
