{
  "name": "city.tax_clerk",
  "version": "0.4.1",
  "doc": "docs/behaviour/government.md",
  "params": {
    "grace_days": {
      "schema": {
        "type": "integer"
      },
      "unit": "days",
      "default": 45,
      "source": "placeholder"
    },
    "law": {
      "schema": {
        "type": "string"
      },
      "default": "law-tax",
      "source": "placeholder"
    }
  },
  "perceives": [],
  "state": "none"
}
