{
  "name": "city.council_clerk",
  "version": "0.10.0",
  "doc": "docs/behaviour/government.md",
  "params": {
    "electoral": {
      "schema": {
        "type": "string"
      },
      "default": "",
      "source": "placeholder"
    },
    "members_every_days": {
      "schema": {
        "type": "integer"
      },
      "unit": "days",
      "default": 30,
      "source": "placeholder"
    },
    "members_role": {
      "schema": {
        "type": "string"
      },
      "default": "councillor",
      "source": "placeholder"
    },
    "vote_days": {
      "schema": {
        "type": "integer"
      },
      "unit": "days",
      "default": 14,
      "source": "placeholder"
    },
    "who": {
      "schema": {
        "type": "string",
        "description": "its channel onto who's who, where it looks up its council's members (\"\": it knows them as it is shown them)"
      },
      "default": "",
      "source": "placeholder"
    }
  },
  "perceives": [],
  "state": "none",
  "issues": [
    {
      "form": "council_ballot",
      "title": "A ballot of the council on a proposal",
      "fields": {
        "proposal": {
          "type": "record",
          "required": true,
          "description": "The proposal put to the vote."
        },
        "open_for": {
          "type": "duration",
          "required": true,
          "description": "How long the ballot stays open."
        },
        "tags": {
          "type": "list",
          "description": "What the proposal is about, a word each (budget, tenant_protection, development)."
        }
      },
      "writes": {
        "kind": "ballot",
        "text": "Ballot of the council on {proposal}, open for {open_for}.",
        "basis": "=proposal",
        "data": {
          "proposal": "=proposal",
          "options": [
            "yes",
            "no"
          ],
          "closes_at": "+open_for",
          "electorate": "council",
          "tags": "=tags"
        }
      }
    },
    {
      "form": "council_result",
      "title": "The result of a ballot of the council",
      "fields": {
        "ballot": {
          "type": "record",
          "required": true,
          "description": "The ballot counted."
        },
        "yes": {
          "type": "count",
          "required": true,
          "description": "Votes for."
        },
        "no": {
          "type": "count",
          "required": true,
          "description": "Votes against."
        },
        "passed": {
          "type": "choice",
          "required": true,
          "options": [
            "yes",
            "no"
          ],
          "description": "Whether it passed."
        },
        "voted_for": {
          "type": "list",
          "description": "The councillors' posts that voted for (a council's votes are public record)."
        },
        "voted_against": {
          "type": "list",
          "description": "The councillors' posts that voted against."
        }
      },
      "writes": {
        "kind": "ballot_result",
        "text": "Result of {ballot}: {yes} for, {no} against.",
        "basis": "=ballot",
        "data": {
          "ballot": "=ballot",
          "yes": "=yes",
          "no": "=no",
          "passed": "?passed",
          "voted_for": "=voted_for",
          "voted_against": "=voted_against"
        }
      }
    },
    {
      "form": "adopted_budget",
      "title": "The budget as the council adopted it",
      "fields": {
        "year": {
          "type": "count",
          "required": true,
          "description": "The year the budget is for."
        },
        "ballot": {
          "type": "record",
          "required": true,
          "description": "The ballot that adopted it."
        }
      },
      "writes": {
        "kind": "budget",
        "text": "The town's budget for year {year}.",
        "basis": "=ballot",
        "data": {
          "year": "=year",
          "lines": {}
        }
      }
    }
  ]
}
