{
  "name": "world.disposal",
  "version": "0.1.0",
  "doc": "docs/behaviour/services.md",
  "params": {
    "account": {
      "schema": {
        "type": "string"
      },
      "default": "",
      "source": "placeholder"
    },
    "every_days": {
      "schema": {
        "type": "integer"
      },
      "unit": "days",
      "default": 30,
      "source": "placeholder"
    },
    "kind": {
      "schema": {
        "type": "string"
      },
      "default": "waste",
      "source": "placeholder"
    },
    "price_per_tonne": {
      "schema": {
        "type": "integer"
      },
      "default": 0,
      "source": "placeholder"
    }
  },
  "perceives": [],
  "state": "none"
}
