{
  "name": "world.migration",
  "version": "0.6.2",
  "doc": "docs/behaviour/boundary.md",
  "params": {
    "households": {
      "schema": {
        "description": "who comes, as the world's profile describes households (required)"
      },
      "default": null,
      "source": "who comes, as the world's profile describes households (required)"
    },
    "jobseekers_payment": {
      "schema": {
        "type": "string",
        "description": "the support payments whose published recipients count as jobseekers (several: with commas between; \"\": none published)"
      },
      "default": "",
      "source": "placeholder"
    },
    "max_households_per_month": {
      "schema": {
        "type": "integer"
      },
      "default": 8,
      "source": "placeholder"
    },
    "memory_days": {
      "schema": {
        "type": "integer"
      },
      "unit": "days",
      "default": 90,
      "source": "placeholder"
    },
    "outside_monthly_income": {
      "schema": {
        "type": "integer",
        "description": "what a household's earner could get elsewhere, cents a month (placeholder)"
      },
      "default": 250000,
      "source": "what a household's earner could get elsewhere, cents a month (placeholder)"
    },
    "participation_bps": {
      "schema": {
        "type": "integer",
        "description": "of adults other than the one who came for the job, those looking for work"
      },
      "unit": "bps",
      "default": 10000,
      "source": "placeholder"
    },
    "response_bps": {
      "schema": {
        "type": "integer",
        "description": "chance per posting, per 100% gap, that a household comes this month (placeholder)"
      },
      "unit": "bps",
      "default": 1000,
      "source": "chance per posting, per 100% gap, that a household comes this month (placeholder)"
    },
    "savings_by_age": {
      "schema": {
        "description": "the world's: an adult's savings by age (else months of income elsewhere)"
      },
      "default": null,
      "source": "placeholder"
    },
    "savings_months": {
      "schema": {
        "type": "array"
      },
      "unit": "months",
      "default": [
        1,
        3
      ],
      "source": "placeholder"
    },
    "schooling": {
      "schema": {},
      "default": null,
      "source": "placeholder"
    },
    "search_limit": {
      "schema": {
        "type": "integer"
      },
      "default": 200,
      "source": "placeholder"
    },
    "template": {
      "schema": {
        "type": "string"
      },
      "default": "newcomer",
      "source": "placeholder"
    },
    "template_outside_lf": {
      "schema": {
        "type": "string",
        "description": "the template for those who aren't (\"\": everyone takes `template`)"
      },
      "default": "",
      "source": "placeholder"
    },
    "who": {
      "schema": {
        "type": "string",
        "description": "its channel onto who's who, where it looks up how to reach those it brought (\"\": as it is shown)"
      },
      "default": "",
      "source": "placeholder"
    },
    "seeker_ages": {
      "schema": {
        "type": "array",
        "description": "the ages the one who comes for the job is of: from, and below (a household moving for work has its earner of working age); absent: any"
      },
      "default": null,
      "source": "the world gives it: the profile's working ages (18 to its retirement age)"
    }
  },
  "perceives": [],
  "state": "none"
}
